Guru Meditation Error: Core  1 panic'ed (StoreProhibited). Exception was unhandled.
Core 1 register dump:
PC      : 0x4000c3f5  PS      : 0x00060730  A0      : 0x800e40d8  A1      : 0x3ffb1b20
A2      : 0x00000000  A3      : 0x3f4010d3  A4      : 0x00000004  A5      : 0x0000ff00
A6      : 0x00ff0000  A7      : 0xff000000  A8      : 0x00000000  A9      : 0x00000000
A10     : 0x00000062  A11     : 0x00000000  A12     : 0x3ffb21f0  A13     : 0x00000000
A14     : 0x00000000  A15     : 0x00000000  SAR     : 0x00000010  EXCCAUSE: 0x0000001d
EXCVADDR: 0x00000000  LBEG    : 0x400014fd  LEND    : 0x4000150d  LCOUNT  : 0xfffffffe

Backtrace: 0x4000c3f5:0x3ffb1b20 0x400e40d5:0x3ffb1b40 0x400df57a:0x3ffb1b70 0x400dc089:0x3ffb1e80 0x400d145d:0x3ffb1f40 0x400d14c4:0x3ffb1f60 0x400d1508:0x3ffb1f80 0x400ea802:0x3ffb1fa0

Rebooting...
////
A10     : 0x00000024  A11     : 0x00000020  A12     : 0x00000001  A13     : 0x00000001
A14     : 0x00060d20  A15     : 0x00000000  SAR     : 0x0000000a  EXCCAUSE: 0x0000001d
EXCVADDR: 0x00000000  LBEG    : 0x4000c349  LEND    : 0x4000c36b  LCOUNT  : 0xffffffff

Backtrace: 0x400d2884:0x3ffb1e50 0x400d26a6:0x3ffb1e90 0x400d24a3:0x3ffb1ec0 0x400d2b2e:0x3ffb1ee0 0x400d146b:0x3ffb1f60 0x400ea962:0x3ffb1fa0

Rebooting...
OBD Firmware Version 11
Initializing modem...
Modem info:Call Ready  SIM800 R14.18
Waiting for GSM network...
Telecom Network connected
 OK
Connecting to v-internet
GPRS  connected
 IoT System Connected!Ready for operation
[29120] #0Guru Meditation Error: Core  1 panic'ed (StoreProhibited). Exception was unhandled.
Core 1 register dump:
PC      : 0x400d2884  PS      : 0x00060d33  A0      : 0x800d26a9  A1      : 0x3ffb1e50
A2      : 0x00000000  A3      : 0x00000000  A4      : 0x00000000  A5      : 0x00002710
A6      : 0x00000000  A7      : 0x000075c0  A8      : 0x00000024  A9      : 0x00000000
A10     : 0x00000024  A11     : 0x00000020  A12     : 0x00000001  A13     : 0x00000001
A14     : 0x00060d20  A15     : 0x00000000  SAR     : 0x0000000a  EXCCAUSE: 0x0000001d
EXCVADDR: 0x00000000  LBEG    : 0x4000c349  LEND    : 0x4000c36b  LCOUNT  : 0xffffffff

Backtrace: 0x400d2884:0x3ffb1e50 0x400d26a6:0x3ffb1e90 0x400d24a3:0x3ffb1ec0 0x400d2b2e:0x3ffb1ee0 0x400d146b:0x3ffb1f60 0x400ea962:0x3ffb1fa0

Rebooting...
OBD Firmware Version 11
Initializing modem...
Modem info:Call Ready  SIM800 R14.18
Waiting for GSM network...
Telecom Network connected
 OK
Connecting to v-internet
GPRS  connected
 IoT System Connected!Ready for operation
[28820] #0Guru Meditation Error: Core  1 panic'ed (StoreProhibited). Exception was unhandled.
Core 1 register dump:
PC      : 0x400d2884  PS      : 0x00060d33  A0      : 0x800d26a9  A1      : 0x3ffb1e50
A2      : 0x00000000  A3      : 0x00000000  A4      : 0x00000000  A5      : 0x00002710
A6      : 0x00000000  A7      : 0x00007494  A8      : 0x00000024  A9      : 0x00000000
A10     : 0x00000024  A11     : 0x00000020  A12     : 0x00000001  A13     : 0x00000001
A14     : 0x00060d20  A15     : 0x00000000  SAR     : 0x0000000a  EXCCAUSE: 0x0000001d
EXCVADDR: 0x00000000  LBEG    : 0x4000c349  LEND    : 0x4000c36b  LCOUNT  : 0xffffffff

Backtrace: 0x400d2884:0x3ffb1e50 0x400d26a6:0x3ffb1e90 0x400d24a3:0x3ffb1ec0 0x400d2b2e:0x3ffb1ee0 0x400d146b:0x3ffb1f60 0x400ea962:0x3ffb1fa0

Rebooting...
OBD Firmware Version 11
Initializing modem...

--- exit ---
Exception in thread rx:
Traceback (most recent call last):
  File "C:\Python27\Lib\threading.py", line 801, in __bootstrap_inner
    self.run()
  File "C:\Python27\Lib\threading.py", line 754, in run
    self.__target(*self.__args, **self.__kwargs)
  File "c:\users\thao\.platformio\penv\lib\site-packages\serial\tools\miniterm.py", line 445, in reader
    data = self.serial.read(self.serial.in_waiting or 1)
  File "c:\users\thao\.platformio\penv\lib\site-packages\serial\serialwin32.py", line 257, in in_waiting
    raise SerialException("ClearCommError failed ({!r})".format(ctypes.WinError()))
SerialException: ClearCommError failed (WindowsError(5, 'Access is denied.'))

//////////
ebooting...
DB_Rev: 0D: ATI
DB_Rev: 0D: ATI
DB_Rev: 0D: ATI
OBD Firmware Version 0
Connecting to OBD...Guru Meditation Error: Core  1 panic'ed (LoadProhibited). Exception was unhandled.
Core 1 register dump:
PC      : 0x400ea100  PS      : 0x00060b30  A0      : 0x800e994d  A1      : 0x3ffb1e50
A2      : 0x00000000  A3      : 0x3ffb25f0  A4      : 0x00000009  A5      : 0x00000040
A6      : 0x00000010  A7      : 0x3ffb0040  A8      : 0x00000003  A9      : 0x00000001
A10     : 0x3ffb25f0  A11     : 0x00000001  A12     : 0x00000050  A13     : 0x00000020
A14     : 0xff000000  A15     : 0x00000000  SAR     : 0x00000018  EXCCAUSE: 0x0000001c
EXCVADDR: 0x00000000  LBEG    : 0x4000c349  LEND    : 0x4000c36b  LCOUNT  : 0xffffffff

Backtrace: 0x400ea100:0x3ffb1e50 0x400e994a:0x3ffb1e70 0x400d1f79:0x3ffb1e90 0x400d1fa7:0x3ffb1eb0 0x400d258d:0x3ffb1ee0 0x400d14cd:0x3ffb1f60 0x400ea232:0x3ffb1fa0

Rebooting...
DB_Rev: 0D: ATI
DB_Rev: 0D: ATI
DB_Rev: 0D: ATI
OBD Firmware Version 0
Connecting to OBD...Guru Meditation Error: Core  1 panic'ed (LoadProhibited). Exception was unhandled.
Core 1 register dump:
PC      : 0x400ea100  PS      : 0x00060b30  A0      : 0x800e994d  A1      : 0x3ffb1e50
A2      : 0x00000000  A3      : 0x3ffb25f0  A4      : 0x00000009  A5      : 0x00000040
A6      : 0x00000010  A7      : 0x3ffb0040  A8      : 0x00000003  A9      : 0x00000001
A10     : 0x3ffb25f0  A11     : 0x00000001  A12     : 0x00000050  A13     : 0x00000020
A14     : 0xff000000  A15     : 0x00000000  SAR     : 0x00000018  EXCCAUSE: 0x0000001c
EXCVADDR: 0x00000000  LBEG    : 0x4000c349  LEND    : 0x4000c36b  LCOUNT  : 0xffffffff

Backtrace: 0x400ea100:0x3ffb1e50 0x400e994a:0x3ffb1e70 0x400d1f79:0x3ffb1e90 0x400d1fa7:0x3ffb1eb0 0x400d258d:0x3ffb1ee0 0x400d14cd:0x3ffb1f60 0x400ea232:0x3ffb1fa0

Rebooting...
DB_Rev: 0D: ATI
DB_Rev: 0D: ATI
DB_Rev: 0D: ATI
OBD Firmware Version 0
Connecting to OBD...Guru Meditation Error: Core  1 panic'ed (LoadProhibited). Exception was unhandled.
Core 1 register dump:
PC      : 0x400ea100  PS      : 0x00060b30  A0      : 0x800e994d  A1      : 0x3ffb1e50
A2      : 0x00000000  A3      : 0x3ffb25f0  A4      : 0x00000009  A5      : 0x00000040
A6      : 0x00000010  A7      : 0x3ffb0040  A8      : 0x00000003  A9      : 0x00000001
A10     : 0x3ffb25f0  A11     : 0x00000001  A12     : 0x00000050  A13     : 0x00000020
A14     : 0xff000000  A15     : 0x00000000  SAR     : 0x00000018  EXCCAUSE: 0x0000001c
EXCVADDR: 0x00000000  LBEG    : 0x4000c349  LEND    : 0x4000c36b  LCOUNT  : 0xffffffff

Backtrace: 0x400ea100:0x3ffb1e50 0x400e994a:0x3ffb1e70 0x400d1f79:0x3ffb1e90 0x400d1fa7:0x3ffb1eb0 0x400d258d:0x3ffb1ee0 0x400d14cd:0x3ffb1f60 0x400ea232:0x3ffb1fa0

Rebooting...
DB_Rev: 0D: ATI
DB_Rev: 0D: ATI
DB_Rev: 0D: ATI
OBD Firmware Version 0
Connecting to OBD...Guru Meditation Error: Core  1 panic'ed (LoadProhibited). Exception was unhandled.
Core 1 register dump:
PC      : 0x400ea100  PS      : 0x00060b30  A0      : 0x800e994d  A1      : 0x3ffb1e50
A2      : 0x00000000  A3      : 0x3ffb25f0  A4      : 0x00000009  A5      : 0x00000040
A6      : 0x00000010  A7      : 0x3ffb0040  A8      : 0x00000003  A9      : 0x00000001
A10     : 0x3ffb25f0  A11     : 0x00000001  A12     : 0x00000050  A13     : 0x00000020
A14     : 0xff000000  A15     : 0x00000000  SAR     : 0x00000018  EXCCAUSE: 0x0000001c
EXCVADDR: 0x00000000  LBEG    : 0x4000c349  LEND    : 0x4000c36b  LCOUNT  : 0xffffffff

Backtrace: 0x400ea100:0x3ffb1e50 0x400e994a:0x3ffb1e70 0x400d1f79:0x3ffb1e90 0x400d1fa7:0x3ffb1eb0 0x400d258d:0x3ffb1ee0 0x400d14cd:0x3ffb1f60 0x400ea232:0x3ffb1fa0

Rebooting...
DB_Rev: 0D: ATI
DB_Rev: 0D: ATI
DB_Rev: 0D: ATI
OBD Firmware Version 0
Connecting to OBD...Guru Meditation Error: Core  1 panic'ed (LoadProhibited). Exception was unhandled.
Core 1 register dump:
PC      : 0x400ea100  PS      : 0x00060b30  A0      : 0x800e994d  A1      : 0x3ffb1e50
A2      : 0x00000000  A3      : 0x3ffb25f0  A4      : 0x00000009  A5      : 0x00000040
A6      : 0x00000010  A7      : 0x3ffb0040  A8      : 0x00000003  A9      : 0x00000001
A10     : 0x3ffb25f0  A11     : 0x00000001  A12     : 0x00000050  A13     : 0x00000020
A14     : 0xff000000  A15     : 0x00000000  SAR     : 0x00000018  EXCCAUSE: 0x0000001c
EXCVADDR: 0x00000000  LBEG    : 0x4000c349  LEND    : 0x4000c36b  LCOUNT  : 0xffffffff

Backtrace: 0x400ea100:0x3ffb1e50 0x400e994a:0x3ffb1e70 0x400d1f79:0x3ffb1e90 0x400d1fa7:0x3ffb1eb0 0x400d258d:0x3ffb1ee0 0x400d14cd:0x3ffb1f60 0x400ea232:0x3ffb1fa0

Rebooting...
DB_Rev: 0D: ATI
DB_Rev: 0D: ATI
DB_Rev: 0D: ATI
OBD Firmware Version 0
Connecting to OBD...Guru Meditation Error: Core  1 panic'ed (LoadProhibited). Exception was unhandled.
Core 1 register dump:
PC      : 0x400ea100  PS      : 0x00060b30  A0      : 0x800e994d  A1      : 0x3ffb1e50
A2      : 0x00000000  A3      : 0x3ffb25f0  A4      : 0x00000009  A5      : 0x00000040
A6      : 0x00000010  A7      : 0x3ffb0040  A8      : 0x00000003  A9      : 0x00000001
A10     : 0x3ffb25f0  A11     : 0x00000001  A12     : 0x00000050  A13     : 0x00000020
A14     : 0xff000000  A15     : 0x00000000  SAR     : 0x00000018  EXCCAUSE: 0x0000001c
EXCVADDR: 0x00000000  LBEG    : 0x4000c349  LEND    : 0x4000c36b  LCOUNT  : 0xffffffff

Backtrace: 0x400ea100:0x3ffb1e50 0x400e994a:0x3ffb1e70 0x400d1f79:0x3ffb1e90 0x400d1fa7:0x3ffb1eb0 0x400d258d:0x3ffb1ee0 0x400d14cd:0x3ffb1f60 0x400ea232:0x3ffb1fa0

Rebooting...
DB_Rev: 0D: ATI
DB_Rev: 0D: ATI
DB_Rev: 0D: ATI
OBD Firmware Version 0
Connecting to OBD...Guru Meditation Error: Core  1 panic'ed (LoadProhibited). Exception was unhandled.
Core 1 register dump:
PC      : 0x400ea100  PS      : 0x00060b30  A0      : 0x800e994d  A1      : 0x3ffb1e50
A2      : 0x00000000  A3      : 0x3ffb25f0  A4      : 0x00000009  A5      : 0x00000040
A6      : 0x00000010  A7      : 0x3ffb0040  A8      : 0x00000003  A9      : 0x00000001
A10     : 0x3ffb25f0  A11     : 0x00000001  A12     : 0x00000050  A13     : 0x00000020
A14     : 0xff000000  A15     : 0x00000000  SAR     : 0x00000018  EXCCAUSE: 0x0000001c
EXCVADDR: 0x00000000  LBEG    : 0x4000c349  LEND    : 0x4000c36b  LCOUNT  : 0xffffffff

Backtrace: 0x400ea100:0x3ffb1e50 0x400e994a:0x3ffb1e70 0x400d1f79:0x3ffb1e90 0x400d1fa7:0x3ffb1eb0 0x400d258d:0x3ffb1ee0 0x400d14cd:0x3ffb1f60 0x400ea232:0x3ffb1fa0

Rebooting...
DB_Rev: 0D: ATI
DB_Rev: 0D: ATI
DB_Rev: 0D: ATI
OBD Firmware Version 0
Connecting to OBD...Guru Meditation Error: Core  1 panic'ed (LoadProhibited). Exception was unhandled.
Core 1 register dump:
PC      : 0x400ea100  PS      : 0x00060b30  A0      : 0x800e994d  A1      : 0x3ffb1e50
A2      : 0x00000000  A3      : 0x3ffb25f0  A4      : 0x00000009  A5      : 0x00000040
A6      : 0x00000010  A7      : 0x3ffb0040  A8      : 0x00000003  A9      : 0x00000001
A10     : 0x3ffb25f0  A11     : 0x00000001  A12     : 0x00000050  A13     : 0x00000020
A14     : 0xff000000  A15     : 0x00000000  SAR     : 0x00000018  EXCCAUSE: 0x0000001c
EXCVADDR: 0x00000000  LBEG    : 0x4000c349  LEND    : 0x4000c36b  LCOUNT  : 0xffffffff

Backtrace: 0x400ea100:0x3ffb1e50 0x400e994a:0x3ffb1e70 0x400d1f79:0x3ffb1e90 0x400d1fa7:0x3ffb1eb0 0x400d258d:0x3ffb1ee0 0x400d14cd:0x3ffb1f60 0x400ea232:0x3ffb1fa0

Rebooting...
DB_Rev: 0D: ATI
DB_Rev: 0D: ATI
DB_Rev: 0D: ATI
OBD Firmware Version 0
Connecting to OBD...Guru Meditation Error: Core  1 panic'ed (LoadProhibited). Exception was unhandled.
Core 1 register dump:
PC      : 0x400ea100  PS      : 0x00060b30  A0      : 0x800e994d  A1      : 0x3ffb1e50
A2      : 0x00000000  A3      : 0x3ffb25f0  A4      : 0x00000009  A5      : 0x00000040
A6      : 0x00000010  A7      : 0x3ffb0040  A8      : 0x00000003  A9      : 0x00000001
A10     : 0x3ffb25f0  A11     : 0x00000001  A12     : 0x00000050  A13     : 0x00000020
A14     : 0xff000000  A15     : 0x00000000  SAR     : 0x00000018  EXCCAUSE: 0x0000001c
EXCVADDR: 0x00000000  LBEG    : 0x4000c349  LEND    : 0x4000c36b  LCOUNT  : 0xffffffff

Backtrace: 0x400ea100:0x3ffb1e50 0x400e994a:0x3ffb1e70 0x400d1f79:0x3ffb1e90 0x400d1fa7:0x3ffb1eb0 0x400d258d:0x3ffb1ee0 0x400d14cd:0x3ffb1f60 0x400ea232:0x3ffb1fa0

Rebooting...


--- Miniterm on COM11  115200,8,N,1 ---
--- Quit: Ctrl+C | Menu: Ctrl+T | Help: Ctrl+T followed by Ctrl+H ---
DB_Rev: 2906640
DB_Rev: 2906640D: ATI
DB_Rev: 2906640D: ATI
OBD Firmware Version 0
DB_Rev: 290164Guru Medita